{
  "$schema": "https://json-schema.org/draft/2020-12/schema",
  "$id": "https://ladderoneacademy.local/schemas/card-deck.schema.json",
  "title": "L1A Card Deck",
  "description": "One module's curated note cards: content/<tier>/cards/<NN>-<slug>.json, e.g. content/emt/cards/02-airway.json. This is the deck that ships with the module, laid out and ordered. Custom decks the learner builds on the fly are assembled in memory from these same records and are never written back here. Cards whose id does not begin with this file's module_id do not belong here.",
  "type": "object",
  "additionalProperties": false,
  "required": ["schema_version", "module_id", "tier", "cards"],

  "properties": {
    "schema_version": {
      "type": "string",
      "const": "1.0.0",
      "default": "1.0.0"
    },
    "module_id": {
      "description": "Module this deck belongs to: TIER-MM. Every card id here starts with it.",
      "type": "string",
      "pattern": "^(EMT|FIRE|MEDIC)-[0-9]{2}$"
    },
    "tier": {
      "description": "Matches the content/ subfolder name and the module file's tier.",
      "type": "string",
      "enum": ["emt", "fire", "medic"]
    },
    "cards": {
      "description": "The cards, inline. Print order is card.number where set, otherwise array order.",
      "type": "array",
      "minItems": 1,
      "items": { "$ref": "card.schema.json" }
    }
  }
}
