{
  "schema_version": "1.0.0",
  "module_id": "EMT-02",
  "tier": "emt",
  "cards": [
    {
      "schema_version": "1.0.0",
      "id": "EMT-02-01-01-C01",
      "concept_id": "EMT-02-01-01",
      "type": "concept",
      "front": {
        "title": "Upper vs. lower airway",
        "summary": "Why the airway is described in two halves."
      },
      "back": {
        "body": "The airway is split into an upper and a lower section at a named landmark. Each half has its own characteristic set of problems, which is what makes the split worth knowing rather than trivia.",
        "why_it_matters": "Structure names from one half are the standard distractors for the other."
      },
      "high_yield": false,
      "number": 1,
      "print_size": "3x5",
      "footer": {
        "tier": "EMT",
        "rung": 1,
        "module_number": 2,
        "module_name": "Airway"
      },
      "verify": true,
      "verify_notes": "Placeholder card generated from this concept's stub key points. Nothing on it has been checked against a source text and no clinical figures are present. Rebuild from the concept's card_data once the concept itself is filled in."
    },
    {
      "schema_version": "1.0.0",
      "id": "EMT-02-01-02-C02",
      "concept_id": "EMT-02-01-02",
      "type": "concept",
      "front": {
        "title": "Pediatric airway differences",
        "summary": "A child is not a small adult."
      },
      "back": {
        "body": "Several parts of a child's airway are proportioned differently from an adult's. Each difference changes something you physically do — how you position, how you size equipment, how you ventilate.",
        "why_it_matters": "It is why pediatric airway questions have different right answers than the adult versions."
      },
      "high_yield": false,
      "number": 2,
      "print_size": "3x5",
      "footer": {
        "tier": "EMT",
        "rung": 1,
        "module_number": 2,
        "module_name": "Airway"
      },
      "verify": true,
      "verify_notes": "Placeholder card generated from this concept's stub key points. Nothing on it has been checked against a source text and no clinical figures are present. Rebuild from the concept's card_data once the concept itself is filled in."
    },
    {
      "schema_version": "1.0.0",
      "id": "EMT-02-02-01-C03",
      "concept_id": "EMT-02-02-01",
      "type": "concept",
      "front": {
        "title": "Head-tilt/chin-lift",
        "summary": "The default manual airway maneuver."
      },
      "back": {
        "body": "In an unresponsive patient the tongue is the most likely obstruction. This maneuver moves the jaw, and the tongue with it, off the back of the throat. It is the first choice when nothing about the mechanism raises a spinal concern.",
        "why_it_matters": "Its one contraindication is the entire reason the other maneuver exists."
      },
      "high_yield": false,
      "number": 3,
      "print_size": "3x5",
      "footer": {
        "tier": "EMT",
        "rung": 1,
        "module_number": 2,
        "module_name": "Airway"
      },
      "verify": true,
      "verify_notes": "Placeholder card generated from this concept's stub key points. Nothing on it has been checked against a source text and no clinical figures are present. Rebuild from the concept's card_data once the concept itself is filled in."
    },
    {
      "schema_version": "1.0.0",
      "id": "EMT-02-02-02-C04",
      "concept_id": "EMT-02-02-02",
      "type": "compare",
      "front": {
        "title": "Head-tilt/chin-lift vs. jaw-thrust",
        "summary": "Which maneuver, and why."
      },
      "back": {
        "body": "Both open the airway. Head-tilt/chin-lift is the default when nothing about the mechanism suggests a spinal injury. Jaw-thrust is for when it does — it gets the jaw forward without the head movement the default requires.",
        "why_it_matters": "Pick the maneuver that matches how the patient got hurt."
      },
      "high_yield": false,
      "number": 4,
      "print_size": "3x5",
      "footer": {
        "tier": "EMT",
        "rung": 1,
        "module_number": 2,
        "module_name": "Airway"
      },
      "verify": true,
      "verify_notes": "Placeholder card generated from this concept's stub key points. Nothing on it has been checked against a source text and no clinical figures are present. Rebuild from the concept's card_data once the concept itself is filled in."
    },
    {
      "schema_version": "1.0.0",
      "id": "EMT-02-03-01-C01",
      "concept_id": "EMT-02-03-01",
      "type": "numbers",
      "front": {
        "title": "Oxygen cylinders at a glance",
        "summary": "Sizes, pressures, and the duration formula."
      },
      "back": {
        "body": "Full ~2,000 psi · Swap at 200 psi · D ~350 L (0.16) · E ~625 L (0.28) · M ~3,000 L (1.56) · Duration (min) = (psi − 200) × constant ÷ L/min",
        "why_it_matters": "The duration calculation and the 200 psi rule are guaranteed exam material and real-world safety."
      },
      "high_yield": true,
      "number": 5,
      "print_size": "3x5",
      "footer": {
        "tier": "EMT",
        "rung": 1,
        "module_number": 2,
        "module_name": "Airway"
      },
      "verify": true,
      "verify_notes": "Drafted from standard EMT curriculum (AAOS Emergency Care 12e level) and not yet reviewed against a source text, same as its parent concept EMT-02-03-01. Check every figure on this card against the source before it is printed or drilled."
    },
    {
      "schema_version": "1.0.0",
      "id": "EMT-02-03-01-C02",
      "concept_id": "EMT-02-03-01",
      "type": "concept",
      "front": {
        "title": "Oxygen safety",
        "summary": "Oxygen is not flammable, but it makes everything else burn."
      },
      "back": {
        "body": "No oil, grease, or petroleum near fittings · Secure the cylinder · Away from heat and flame · Open the valve slowly, stand to the side · Check the hydrostatic test date",
        "why_it_matters": "A sheared valve turns a cylinder into a projectile; a greased fitting can ignite."
      },
      "high_yield": false,
      "number": 6,
      "print_size": "3x5",
      "footer": {
        "tier": "EMT",
        "rung": 1,
        "module_number": 2,
        "module_name": "Airway"
      },
      "verify": true,
      "verify_notes": "Drafted from standard EMT curriculum (AAOS Emergency Care 12e level) and not yet reviewed against a source text, same as its parent concept EMT-02-03-01. Check every figure on this card against the source before it is printed or drilled."
    },
    {
      "schema_version": "1.0.0",
      "id": "EMT-02-03-02-C01",
      "concept_id": "EMT-02-03-02",
      "type": "compare",
      "front": {
        "title": "Nasal cannula vs. non-rebreather",
        "summary": "The two devices you will use on almost every call."
      },
      "back": {
        "body": "Cannula: 1 to 6 L/min · 24 to 44% · breathing well, mildly low sat · not for mouth breathers or distress. NRB: 10 to 15 L/min · up to ~90% · breathing adequately, needs high O2 · not for inadequate breathing (use BVM).",
        "why_it_matters": "Device selection is the single most-tested airway decision at the EMT level."
      },
      "high_yield": true,
      "number": 7,
      "print_size": "3x5",
      "footer": {
        "tier": "EMT",
        "rung": 1,
        "module_number": 2,
        "module_name": "Airway"
      },
      "verify": true,
      "verify_notes": "Drafted from standard EMT curriculum (AAOS Emergency Care 12e level) and not yet reviewed against a source text, same as its parent concept EMT-02-03-02. Check every figure on this card against the source before it is printed or drilled."
    },
    {
      "schema_version": "1.0.0",
      "id": "EMT-02-03-03-C01",
      "concept_id": "EMT-02-03-03",
      "type": "skill",
      "front": {
        "title": "Applying a non-rebreather",
        "summary": "Six steps; four are critical."
      },
      "back": {
        "body": "1. Confirm adequate breathing (critical) · 2. Set 10 to 15 L/min (critical) · 3. Fill the reservoir before applying (critical) · 4. Seal mask, tighten strap · 5. Bag must not collapse more than one-third; raise flow if it does (critical) · 6. Reassess SpO2 and work of breathing",
        "why_it_matters": "Skipping the reservoir fill or missing inadequate breathing are the two classic errors."
      },
      "high_yield": true,
      "number": 8,
      "print_size": "3x5",
      "footer": {
        "tier": "EMT",
        "rung": 1,
        "module_number": 2,
        "module_name": "Airway"
      },
      "verify": true,
      "verify_notes": "Drafted from standard EMT curriculum (AAOS Emergency Care 12e level) and not yet reviewed against a source text, same as its parent concept EMT-02-03-03. Check every figure on this card against the source before it is printed or drilled."
    },
    {
      "schema_version": "1.0.0",
      "id": "EMT-02-03-04-C01",
      "concept_id": "EMT-02-03-04",
      "type": "compare",
      "front": {
        "title": "Partial rebreather vs. Venturi",
        "summary": "Two masks you need to recognize but rarely use."
      },
      "back": {
        "body": "Partial rebreather: no one-way valve, some rebreathing, ~40 to 60%, 6 to 10 L/min, rare in EMS. Venturi: color-coded adapters, precise ~24 to 50%, flow printed on adapter, for controlled FiO2 (some COPD).",
        "why_it_matters": "The exam asks which device gives a precise concentration and what makes a partial rebreather different."
      },
      "high_yield": false,
      "number": 9,
      "print_size": "3x5",
      "footer": {
        "tier": "EMT",
        "rung": 1,
        "module_number": 2,
        "module_name": "Airway"
      },
      "verify": true,